Track Name,Artist Name,URI,Lyrics
Black Widow,Iggy Azalea,spotify:track:71vsEyBd4X1D5BUmLdFSVH,"[""And I'm gonna show ya"", ""What's really crazy"", ""You should've known better"", 'Than to mess with me harder', ""I'm gonna love ya, I'm gonna love ya, gonna love ya"", 'Gonna love ya like a black widow, baby', 'This twisted cat and mouse game always starts the same', ""First we're both down to play, then somehow you go astray"", ""We went from nothin' to something, liking to lovin'"", 'It was us against the world, and now we just fucking?', ""It's like I loved you so much, and now I just hate you"", ""Feelin' stupid for all the time that I gave you"", ""I wanted all or nothin' for us, ain't no place in between"", ""Might, might be me believin' what you say that you'll never mean"", ""Like it'll last forever, but now forever ain't as long"", ""If it wasn't for you, I wouldn't be stuck singin' this song"", ""You were different from my last, but now you got 'em mirrored"", ""And as it all plays out, I see it couldn't be clearer, now sing"", 'You used to be thirsty for me', 'But now you wanna be set free', 'This is the web', 'Web that you weave', ""So baby now rest in peace (It's all over with now)"", ""I'm gonna love ya"", 'Until you hate me (Right)', ""And I'm gonna show ya (Show 'em what, show 'em what?)"", ""What's really crazy"", ""You should've known better"", ""Than to mess with me harder (It's all over with now)"", ""I'm gonna love ya, I'm gonna love ya, gonna love ya"", 'Gonna love ya like a black widow, baby', 'Black, black widow, baby', ""I'm gonna l-l-l-love you until it hurts"", ""Just to get you, I'm doin' whatever works"", ""You ain't ever met nobody that will do ya how I do ya"", ""That'll bring you to your knees, praise Jesus, hallelujah"", ""I'ma make you beg for it, plead for it"", ""'Til you feel like you breathe for it"", ""'Til you'll do any and everything for it"", 'I want you to fiend for it, wake up and dream for it', ""'Til it's got you gaspin' for air and you lean forward"", ""'Til they have a CAT scan to check on your mind"", ""And it's nothin' but me, on it (On it, on it)"", ""Now it's me time, believe that"", ""If it's yours and you want it, I want it, promise I need that"", ""'Til I'm everywhere that you be at, I can't fall back or quit"", ""'Cause this here is fatal attraction, so I take it all or I don't want shhh"", 'You used to be thirsty for me (Right)', 'But now you wanna be set free', 'This is the web', 'Web that you weave', ""So baby now rest in peace (It's all over with now)"", ""I'm gonna love ya"", 'Until you hate me (Right)', ""And I'm gonna show ya (Show 'em what, show 'em what?)"", ""What's really crazy (Oh)"", ""You should've known better"", 'Than to mess with me harder', ""I'm gonna love ya, I'm gonna love ya, gonna love ya"", 'Gonna love ya like a black widow, baby']"
Hotline Bling,Drake,spotify:track:0wwPcA6wtMf6HUMpIRdeP7,"['Yeah', 'You used to call me on my cell phone', 'Late-night when you need my love', 'Call me on my cell phone', 'Late-night when you need my love', 'And I know when that hotline bling', 'That can only mean one thing', 'I know when that hotline bling', 'That can only mean one thing', 'Ever since I left the city, you', 'Got a reputation for yourself now', 'Everybody knows and I feel left out', 'Girl, you got me down, you got me stressed out', ""'Cause ever since I left the city, you"", ""Started wearing less and goin' out more"", 'Glasses of champagne out on the dance floor', ""Hangin' with some girls I never seen before"", 'You used to call me on my cell phone', 'Late-night when you need my love', 'Call me on my cell phone', 'Late-night when you need my love', 'I know when that hotline bling', 'That can only mean one thing', 'I know when that hotline bling', 'That can only mean one thing', 'Ever since I left the city, you, you, you', ""You and me, we just don't get along"", 'You make me feel like I did you wrong', ""Going places where you don't belong"", 'Ever since I left the city, you', 'You got exactly what you asked for', 'Running out of pages in your passport', ""Hangin' with some girls I've never seen before"", 'You used to call me on my cell phone', 'Late-night when you need my love', 'Call me on my cell phone', 'Late-night when you need my love', 'And I know when that hotline bling', 'That can only mean one thing', 'I know when that hotline bling', 'That can only mean one thing', 'These days, all I do is', ""Wonder if you're bendin' over backwards for someone else"", ""Wonder if you're rolling up a Backwoods for someone else"", ""Doing things I taught you, gettin' nasty for someone else"", ""You don't need no one else"", ""You don't need nobody else, no"", 'Why you never alone?', 'Why you always touching road?', 'Used to always stay at home', 'Be a good girl, you was in the zone', 'Yeah, you should just be yourself', ""Right now, you're someone else"", 'You used to call me on my cell phone', 'Late-night when you need my love', 'Call me on my cell phone', 'Late-night when you need my love', 'And I know when that hotline bling', 'That can only mean one thing', 'I know when that hotline bling', 'That can only mean one thing']"
Champions,Kanye West,spotify:track:2nBI3iWLhupR7LyAJ5GGkE,"['Hundred thousand dollar chandelier (Chandelier)', 'They tried to turn me to an animal (Animal)', ""But white people think I'm radical (Radical)"", ""Supermodels think I'm handsome (Handsome)"", ""You might think I'm too aggressive (Aggressive)"", ""But really I think I'm too passive (Hey)"", ""'Til I pull out the chopper, start blastin' (Bow)"", '1500, all in singles (Straight up!)', 'Throw it up, watch it fall and drop', ""'Round and 'round they go"", ""'Round and 'round they go (Yeah, yeah, yeah, yeah)"", 'Pray for me', ""I'm about to hit the Ye button"", ""I don't wanna say nothin' wrong"", ""But it'd be wrong if I ain't say nothin'"", ""Imagine if I ain't say somethin'"", ""Wouldn't none these niggas say nothin'"", 'I done lost and made money', ""Now I'm makin' somethin' they can't take from me"", ""And I'm fresh out of debt in this mothafucka!"", ""And they still ain't ready yet for a muhfucka!"", 'Yeezy might have to go and put his Louis on', ""I'm 'bout to go Gucci in the Gucci store"", ""It's Gucci!"", 'Fresh out the feds in this mothafucka (Hah)', ""And they still ain't ready yet for a mothafucka (No)"", ""Gucci Mane and I'm 'bout to put my Yeezys on (Huh?)"", ""Now that Gucci home, it's over for you Gucci clones"", '1500, all in singles (Straight up)', 'Throw it up, watch it fall and drop', ""'Round and 'round they go"", ""'Round and 'round they go"", 'Champions, we run the city', ""Number one, they fallin' from the top"", ""'Round and 'round they go"", ""'Round and 'round they go (Straight up)"", 'Look, I say a prayer for my enemies (Prayer)', ""They cannot slow down what's meant for me"", ""Funny how they come around like I can't see through they secret identities"", ""Lately, it's all about Zen in me"", ""Subtractin' the negative energy"", 'Fuck with the family, turn your ass to a memory', 'My niggas keep it a century', 'I blow the check up, nigga, detonation', ""Kill 'em one by one, Final Destination"", 'Top my destination', ""I got guardian angels all around a nigga, that's deflectin' Satan"", ""I'm a mothafuckin' champion"", ""This right here the fuckin' anthem"", ""I can't dap you without hand san'"", ""I don't know where your dirty ass hands been"", 'I wake up to like a hundred texts', ""Championship team, but we can't cut the net (Okay)"", ""She all off in my jersey lookin' underdressed"", ""I'm finna buy this bitch a Honda CRX"", 'With...', '1500, all in singles (straight up!)', 'Throw it up, watch it fall and drop', ""'Round and 'round they go"", ""'Round and 'round it go, 'round and 'round it go"", ""'Round and 'round they go"", ""I'd rather be strapped and ride with a pole"", 'Than to get down in a hole', 'I took a nap in the pulpit', 'I never like how a suit fit', 'I got a pocket full of money', ""It got me walkin' all slew-foot"", ""I'm on my wave like a cruise ship"", 'In that ho mouth like a toothpick', 'Anyone get in my way', ""Nothin' to say, I tote 'em choppas like pool sticks"", ""I wear pajamas to Ruth's Chris"", ""Couldn't walk a mile in my new kicks"", ""I'm comin' from the apartments"", 'We never had our damn pool fixed', 'Walk in the mall with my new bitch', 'Tell her to get the whole rack', ""My new bitch gon' pull me a new bitch"", 'Then pull me a new bitch', 'See that is a snowball effect', 'I got gold on my neck', ""Lookin' like a Super Bowl on my neck"", 'I got a mansion full of marble floors', 'It look like I could go bowl in this bitch', 'Versace logos on bowls in this bitch', ""Like I'm a serial killer"", 'I put the real in gorilla', 'I did this shit for my niggas', '1500, all in singles (straight up!)', 'Throw it up, watch it fall and drop', ""'Round and 'round they go"", ""'Round and 'round it go, 'round and 'round it go"", ""'Round and 'round they go"", ""I'd rather be strapped and ride with a pole"", 'Than to get down in a hole', 'Champions, we run the city', ""Number one, they fallin' from the top"", ""'Round and 'round they go"", ""'Round and 'round it go, 'round and 'round it go"", ""'Round and 'round they go"", ""I'd rather be strapped and ride with a pole"", 'Than to get down in a hole', ""I'm Yo Gotti!"", 'Reach for my chain is suicide', 'The car I drive fit two inside', ""They mad at Ye 'cause he all in the neighborhood"", 'But he let them goons inside', ""Let's fuck up the neighborhood"", ""Let's fuck up the neighborhood"", 'Buy every house in this bitch', 'You know that the money good', ""My wrist in the kitchen go 'round and 'round"", ""Play with the kid, I'ma gun you down"", 'The roof on that Wraith in the lost and found', 'Official trap shit let me slow it down', 'Way more shit than a Pamper', 'All we rock is bandanas', 'Whips so nasty, no manners', 'I just got head in a Phantom', ""She say she don't want a chump, baby want a champ"", 'She say money make her cum, Gucci make her damp (Gucci!)', ""1017's the Squad, Gucci Mane's the stamp"", ""And he don't never sleep, he's a fuckin' vamp"", ""I heard your bitch ride on the bus, you don't give a damn"", ""My bitch drive a Lamb', you should call her ma'am"", 'I love my Auntie Jane, but fuck Uncle Sam', ""I'm a walkin' money machine, check my Instagram"", ""Niggas never test the kid so I don't have to cram"", 'My city treat me like a king, I should wear a crown', ""And I don't really fuck around"", ""I gave my bitch two mil' 'cause she stuck around"", '1500, all in singles (straight up!)', 'Throw it up, watch it fall and drop', ""'Round and 'round they go"", ""'Round and 'round it go, 'round and 'round it go"", ""'Round and 'round they go"", ""I'd rather be strapped and ride with a pole"", 'Than to get down in a hole', 'Champions, we run the city', ""Number one, they fallin' from the top"", ""'Round and 'round they go"", ""'Round and 'round it go"", ""'Round and 'round they go"", ""I'd rather be strapped and ride with a pole""]"
Watch Me (Whip / Nae Nae),Silentó,spotify:track:5RIVoVdkDLEygELLCniZFr,"['Whip, nae nae', 'Whip, whip, nae nae', 'You already know who it is (Bolo)', 'Silentó', 'Silentó', 'Silentó', ""Go on an' do it for me"", 'Now watch me whip (Kill it!)', 'Now watch me nae nae (Okay!)', 'Now watch me whip, whip', 'Watch me nae nae (Watch me do it)', 'Now watch me whip (Kill it!)', 'Now watch me nae nae (Okay!)', 'Now watch me whip, whip', 'Watch me nae nae (Can you do it?)', 'Now watch me, ooh watch me, watch me', 'Ooh, watch me, watch me', 'Ooh, watch me, watch me', 'Ooh, ooh, ooh, ooh', 'Now watch me, ooh, watch me, watch me', 'Ooh, watch me, watch me', 'Ooh, watch me, watch me', 'Ooh, ooh, ooh, ooh', 'Do the stanky leg (Stank) do the stanky leg (Stank-stank)', 'Do the stanky leg (Stank) do the stanky leg (Stank-stank)', 'Do the stanky leg (Stank) do the stanky leg (Stank-stank)', 'Do the stanky leg (Stank) do the stanky leg (Stank-stank)', ""Now break your legs (Break 'em) break your legs (Brake the knob)"", 'Tell \'em ""break your legs"" (Break \'em) break your legs (Brake the knob)', ""Gonna break your legs (Break 'em) break your legs (Brake the knob)"", ""Go'n and break your legs (Break 'em) break your legs (Brake the knob)"", 'Now watch me bop, bop, bop, bop, bop', 'Bop, bop, bop, bop, bop', 'Now watch me bop, bop, bop, bop, bop', 'Bop, bop, bop, bop, bop', 'Now watch me whip (Kill it!)', 'Now watch me nae nae (Okay!)', 'Now watch me whip, whip', 'Watch me nae nae (Watch me do it)', 'Now watch me whip (Kill it!)', 'Now watch me nae nae (Okay!)', 'Now watch me whip, whip', 'Watch me nae nae (Can you do it?)', 'Now watch me, ooh watch me, watch me', 'Ooh, watch me, watch me', 'Ooh, watch me, watch me', 'Ooh, ooh, ooh, ooh', 'Now watch me, ooh, watch me, watch me', 'Ooh, watch me, watch me', 'Ooh, watch me, watch me', 'Ooh, ooh, ooh, ooh', 'Now watch me yule (Soulja!), now watch me Superman (Okay)', 'Now watch me yule (Soulja!), now watch me Superman (Okay)', 'Now watch me yule (Soulja!), now watch me Superman (Okay)', 'Now watch me yule (Soulja!), now watch me Superman (Okay)', 'Now watch me duff, duff, duff, duff, duff', 'Duff, duff, duff (Hold on)', 'Now watch me duff, duff, duff, duff, duff', 'Duff, duff, duff, duff', 'Now watch me bop, bop, bop, bop, bop', 'Bop, bop, bop, bop, bop', 'Now watch me bop, bop, bop, bop, bop', 'Bop, bop, bop, bop, bop', 'Now watch me whip (Kill it!)', 'Now watch me nae nae (Okay!)', 'Now watch me whip, whip', 'Watch me nae nae (Watch me do it)', 'Now watch me whip (Kill it!)', 'Now watch me nae nae (Okay!)', 'Now watch me whip, whip', 'Watch me nae nae (Can you do it?)', 'Now watch me, ooh watch me, watch me', 'Ooh, watch me, watch me', 'Ooh, watch me, watch me', 'Ooh, ooh, ooh, ooh', 'Now watch me, ooh, watch me, watch me', 'Ooh, watch me, watch me', 'Ooh, watch me, watch me']"
Bitch Better Have My Money,Rihanna,spotify:track:0NTMtAO2BV4tnGvw9EgBVq,"['Yayo', 'Bitch better have my money', ""Y'all should know me well enough"", 'Bitch better have my money', ""Please don't call me on my bluff"", 'Pay me what you owe me', ""Ballin' bigger than LeBron"", 'Bitch, give me your money', ""Who y'all think y'all frontin' on?"", 'Like bra, bra, bra', ""Louis XIII, and it's all on me, nigga, you just bought a shot"", ""Kamikaze, if you think that you gon' knock me off the top"", 'Shit, your wife in the backseat of my brand new foreign car', ""Don't act like you forgot"", 'I call the shots, shots, shots', 'Like bra, bra, bra', ""Pay me what you owe me, don't act like you forgot"", 'Bitch better have my money', 'Bitch better have my money', 'Pay me what you owe me', 'Bitch better have my (Bitch better have my)', 'Bitch better have my (Bitch better have my)', 'Bitch better have my money', ""Turn up to Rihanna while the whole club fuckin' wasted"", ""Every time I drop by, I am the only thing y'all playin'"", ""In a drop top, doin' hundred, y'all in my rearview mirror racin'"", ""Where y'all at? Where y'all at? Where y'all at? (Where y'all at?)"", 'Like bra, bra, bra', ""Louis XIII, and it's all on me, nigga, you just bought a shot"", ""Kamikaze, if you think that you gon' knock me off the top"", 'Shit, your wife in the backseat of my brand new foreign car', ""Don't act like you forgot"", 'I call the shots, shots, shots', 'Like bra, bra, bra', ""Pay me what you owe me, don't act like you forgot"", 'Bitch better have my money', 'Bitch better have my money', 'Pay me what you owe me', 'Bitch better have my (Bitch better have my)', 'Bitch better have my (Bitch better have my)', 'Bitch better have my money', 'Bitch better have my money', 'Bitch better have my money', 'Pay me what you owe me', 'Bitch better have my (Bitch better have my)', 'Bitch better have my (Bitch better have my)', 'Bitch better have my money', 'Bitch better have my money', 'Bitch better have my money', 'Bitch, bitch, bitch better have my money', 'Yo, that bitch better have my money', 'Hold up', 'My money', 'Yo, my money', 'That bitch better have my money']"
White Iverson,Post Malone,spotify:track:6eT7xZZlB2mwyzJ2sUKG6w,"[""Saucin', saucin', I'm saucin' on you"", ""I'm swaggin', I'm swaggin', I'm swaggin', oh-ooh (Swaggin')"", ""I'm ballin', I'm ballin', Iverson on you (Swish, ooh, ayy)"", 'Watch out, watch out, watch out, yeah', ""That's my shot, that's my shot, that's my shot, yeah"", ""Spendin', I'm spendin' all my fuckin' pay"", 'I got me some braids and I got me some hoes', ""Started rockin' the sleeve, I can't ball with no Joes"", 'You know how I do it, Concords on my toes', '(This shit is hard) Oh', ""I ain't rich yet, but you know I ain't broke, ah"", 'So if I see it, I like it, buy that from the store, ah (Store, ah)', ""I'm with some white girls and they love them the coca (Coca)"", 'Like they OT', ""Double OT like I'm KD, smokin' OG (Smokin' OG)"", 'And you know me, in my 2-3s and my gold teeth (And my gold teeth)', ""Bitch, I'm smiling, bet you see me from the nosebleeds (Nosebleeds)"", ""I'm the new three and I change out to my new 3s (To my new 3s)"", 'White Iverson', ""When I started ballin', I was young"", ""You gon' think about me when I'm gone"", 'I need that money like the ring I never won, I won', ""Saucin', saucin', I'm saucin' on you"", ""I'm swaggin', I'm swaggin', I'm swaggin', oh-ooh"", ""I'm ballin', I'm ballin', Iverson on you"", 'Watch out, watch out, watch out, yeah', ""That's my shot, that's my shot, that's my shot, yeah"", ""Spendin', I'm spendin' all my fuckin' pay"", 'Ooh, Stoney', 'Cigarettes and a headband', 'Commas, commas in my head, man', 'Slumped over like a dead man', ""Red and black, 'bout my bread, man"", ""I'm the answer, never question"", 'Lace up, learn a lesson', ""Bitch, I'm saucin' (Wow), I do this often, don't do no talkin' (No)"", 'My options right when I walk in, jump all them Jordans (Ooh)', ""I'm ballin', money jumpin'"", ""Like I'm Davis from New Orleans"", ""Or bitch, I'm Harden, I don't miss nothin'"", ""Fuck practice, this shit just happens, know y'all can't stand it (Ayy)"", 'I have it, I never pass it, I work my magic', 'High average, ball on these bastards, it makes me happy', ""It's tragic, I make it happen, and all y'all Shaqtin'"", 'White Iverson', ""When I started ballin', I was young"", ""You gon' think about me when I'm gone"", 'I need that money like the ring I never won, I won', ""Saucin', saucin', I'm saucin' on you"", ""I'm swaggin', I'm swaggin', I'm swaggin', oh-ooh"", ""I'm ballin', I'm ballin', Iverson on you"", 'Watch out, watch out, watch out, yeah', ""That's my shot, that's my shot, that's my shot, yeah"", ""Spendin', I'm spendin' all my fuckin' pay"", 'Ooh-ooh', 'Ooh-ooh', 'Ooh-ooh']"
Gassed Up,Nebu Kiniza,spotify:track:6JjEVlMkfHWMeYavkEYzNO,"[""Yeah, I'm on the East side-I'm on the East side"", 'Aight, yeah-yeah', 'Aight, let me call you back', '(Plugg!)', ""Gassed, gassed, tuh'"", 'Yeah (Yeah, yeah, yeah)', ""Gassed up shorty, said I need 'bout 40 (Whoa, whoa)"", 'Pull up to the party, yeah, yeah, yeah (Yeah, yeah, yeah)', ""Gassed up shorty, said I need 'bout 40 (Whoa, whoa)"", 'Pull up to the party, yeah, yeah, yeah (Yeah, yeah, yeah)', ""Gassed up shorty, said I need 'bout 40 (Whoa, whoa)"", 'Pull up to the party, yeah, yeah, yeah (Yeah, yeah, yeah)', 'Gassed up, I be so gassed up (Yeah, yeah)', 'Turnt up, I be so turnt up right now (Yeah, yeah, yeah)', ""Bad bitch super thick, that's the way I like it (Yeah)"", ""I know all about your tricks, so don't you fucking try it (Whoa)"", ""Leave me 'lone, leave me 'lone, let me get this bread (Whoa)"", 'All I want is a crib and a Superhead (Becky)', ""Yeah I'm good, yeah, I'm good, don't you worry 'bout me (I'm good)"", 'I get high all the time', ""While I'm counting money (Whoa, eah)"", ""I be leanin' (Whoa)"", ""We be movin' (Plugg!)"", 'We be dreaming (Whoa)', ""You'll be losing (Whoa, yup, yup)"", 'And I know what she like (What she like)', 'I know what she want (What she want)', 'I know what she want, yeah, yeah (What she want)', ""Gassed up shorty, said I need 'bout 40 (Plugg!) (Whoa, whoa)"", 'Pull up to the party, yeah, yeah, yeah (Yeah, yeah, yeah)', ""Gassed up shorty, said I need 'bout 40 (Whoa, whoa)"", 'Pull up to the party, yeah, yeah, yeah (Yeah, yeah, yeah)', ""Gassed up shorty, said I need 'bout 40 (Whoa, whoa)"", 'Pull up to the party, yeah, yeah, yeah (Yeah, yeah, yeah)', ""Gassed up shorty, said I need 'bout 40 (Whoa, whoa)"", 'Pull up to the party, yeah, yeah, yeah', ""Bad bitty and she love the way I'm swaggin' (Plugg!)"", 'Everywhere I go they be like ""Yo, what happened?""', 'Looking like a check (Yeah)', ""I can't even flex (No)"", 'Give me my respect', 'I fucked your bitch (Yeah) and got that neck (Whoa)', ""Ain't no stopping (Ayy)"", 'Got to go and cop it (Whoa)', 'All up in my cockpit (Yeah)', ""She just want what's poppin' (Whoa)"", ""Ayy, that ain't nothing to a young G (Whoa)"", 'Yeah, (Yeah) I got that OG', 'Yeah, I got it so cheap (Yeah, yeah, yeah)', ""Like, smoking 'til it's gone (Yeah)"", 'Hit it out the bong (Whoa)', 'We get lots of strong (Yeah)', 'She wanna fuck me long (Long)', ""It ain't nothing to it, we can get filet mignon, ayy (Let's go)"", '5 star plate (Let go)', '5 star plate, ayy (Let go, ayy)', ""Gassed up shorty, said I need 'bout 40 (Plugg!) (Whoa, whoa)"", 'Pull up to the party, yeah, yeah, yeah (Yeah, yeah, yeah)', ""Gassed up shorty, said I need 'bout 40 (Whoa, whoa)"", 'Pull up to the party, yeah, yeah, yeah (Yeah, yeah, yeah)', ""Gassed up shorty, said I need 'bout 40 (Whoa, whoa)"", 'Pull up to the party, yeah, yeah, yeah (Yeah, yeah, yeah)', ""Gassed up shorty, said I need 'bout 40 (Whoa, whoa)"", 'Pull up to the party, yeah, yeah, yeah']"
2 Phones,Kevin Gates,spotify:track:0wdKiSBUT7aZkXUIdJWcwC,"['I got two phones, one for the bitches and one for the dough', 'Think I need two more', ""Line bumpin', I'm ring-ring-ringin'"", ""Countin' money while they ring-ring-ringin'"", ""Trap jumpin', I'm ring-ring-ringin'"", 'I got two phones, one for the plug and one for the load', 'I got two phones, one for the bitches and one for the dough', 'Think I need two more', ""Line bumpin', I'm ring-ring-ringin'"", ""Countin' money while they ring-ring-ringin'"", ""Trap jumpin', I'm ring-ring-ringin'"", ""Button start the foreign, oh my God, I'm gorgeous"", 'I just put the key inside my pocket', 'Park it, might not get to see it, this a new Ferrari', 'Man in the mirror, how you choose to bother', ""Someone said they callin', I don't feel like talkin'"", 'Everything I get returned the way I bought it', ""Phone be interrupting me while I'm recordin'"", 'Phone be making women feel they unimportant', ""Call my dog, he say it's all the way retarded"", ""Keep the oil 'cause I am not using the Foreman"", 'Kitchen, I just finished up a new performance', 'Hater, wish you well', 'I got clientele', 'I just got it off the scale', 'I got two phones, one for the plug and one for the load', 'I got two phones, one for the bitches and one for the dough', 'Think I need two more', ""Line bumpin', I'm ring-ring-ringin'"", ""Countin' money while they ring-ring-ringin'"", ""Trap jumpin', I'm ring-ring-ringin'"", 'I got two phones, one for the plug and one for the load', 'I got two phones, one for the bitches and one for the dough', 'Think I need two more', ""Line bumpin', I'm ring-ring-ringin'"", ""Countin' money while they ring-ring-ringin'"", ""Trap jumpin', I'm ring-ring-ringin'"", 'There they go again, one of my lil friends', ""They don't give a damn how a nigga been"", 'All they wanna know is what I got to give', 'How much did I spend? What I got to lend?', ""What I did and what I didn't do for them"", ""Bricks comin' in somewhere on the rim"", ""Section doin' numbers, nowhere by a gym"", ""Droppin' bottles, spend, I'm supplyin' ten"", ""Jumpin' out a Honda, I just got it in"", ""Askin' what I cop, none of your concern"", 'One day you gone learn what you tryna get', ""Everything on sale, goin' out of biz"", 'Partners up in jail, gotta feed the kids', ""Juggin' round the city, you know what it is"", 'Bread winner business, put that on the wrist', 'I got two phones, one for the plug and one for the load', 'I got two phones, one for the bitches and one for the dough', 'Think I need two more', ""Line bumpin', I'm ring-ring-ringin'"", ""Countin' money while they ring-ring-ringin'"", ""Trap jumpin', I'm ring-ring-ringin'"", 'I got two phones, one for the plug and one for the load', 'I got two phones, one for the bitches and one for the dough', 'Think I need two more', ""Line bumpin', I'm ring-ring-ringin'"", ""Countin' money while they ring-ring-ringin'"", ""Trap jumpin', I'm ring-ring-ringin'"", ""Ring, ring, ringin' man"", 'Find me balling hard', 'Come from grinding hard', 'Getting calling cards from your Barbie doll', ""When she 'round me, she know I'm her bodyguard"", ""Money callin' for me, baby girl, I'm sorry"", 'You just high yella, you not that important', 'Weight, shape her, I could pin you to the carpet', ""Smell like tartar, I'ma put you in the water"", 'Conversation cost a lot of chips', ""She don't really get a lot of this"", ""Engagin' where I'm gazin' at her hips"", ""And ain't nobody makin' no attempts"", 'Amazing clip, hanging, slanging dick', ""Maybe we can make it takin' trips"", ""Maybe I was thinkin' too impatient"", 'Phone ringing, hold up, what it is?', 'I got two phones, one for the plug and one for the load', 'I got two phones, one for the bitches and one for the dough', 'Think I need two more', ""Line bumpin', I'm ring-ring-ringin'"", ""Countin' money while they ring-ring-ringin'"", ""Trap jumpin', I'm ring-ring-ringin'"", 'I got two phones, one for the plug and one for the load', 'I got two phones, one for the bitches and one for the dough', 'Think I need two more', ""Line bumpin', I'm ring-ring-ringin'"", ""Countin' money while they ring-ring-ringin'""]"
