Track Name,Artist Name,URI,Lyrics
Panda,Desiigner,spotify:track:5YEOzOojehCqxGQCcQiyR4,"[""They been waitin’ for this shit for a long time, didn't they?"", ""This what they all been waitin' for? I guess so"", ""They been waitin’ for this shit for a long time, didn't they?"", ""Ayy, I'm just feelin' my vibe right now"", ""I'm feelin' myself"", 'Panda, Panda', 'Panda, Panda, Panda, Panda, Panda', 'I got broads in Atlanta', ""Twistin' dope, lean, and the Fanta"", 'Credit cards and the scammers', ""Hittin' off licks in the bando"", 'Black X6, Phantom', 'White X6 look like a panda', ""Goin' out like I’m Montana"", 'Hundred killas, hundred hammers', 'Black X6, Phantom', 'White X6, panda', 'Pockets swole, Danny', 'Sellin’ bar, candy', ""Man, I'm the macho like Randy"", 'The choppa go Oscar for Grammy', 'Bitch nigga, pull up ya panty', 'Hope you killas understand me', 'I got broads in Atlanta', 'Twistin’ dope, lean, and the Fanta', 'Credit cards and the scammers', ""Hittin' off licks in the bando"", 'Black X6, Phantom', 'White X6 look like a panda', ""Goin' out like I'm Montana"", 'Hundred killas, hundred hammers', 'Black X6, Phantom', 'White X6, panda', 'Pockets swole, Danny', 'Sellin’ bar, candy', ""Man, I'm the macho like Randy"", 'The choppa go Oscar for Grammy', 'Bitch nigga, pull up ya panty', 'Hope you killas understand me', 'Hey', 'Panda, Panda', 'Panda, Panda, Panda, Panda, Panda, Panda, Panda, Panda', 'I got broads in Atlanta', ""Twistin' dope, lean, and shit, sippin' Fanta"", 'Credit cards and the scammers', 'Wake up Versace shit, life Desiigner', 'Whole bunch of lavish shit', ""They be askin' 'round town who be clappin' shit"", ""I be pullin' up stuff in the Phantom ship"", 'I got plenty of stuff in Bugatti whip, look how I drive this shit', 'Black X6, Phantom', ""White X6, killin' on camera"", ""Pop a Perc, I can't stand up"", 'Gorilla, they come and kill you with bananas', 'Four fellas, they finna pull up in the Phantom', 'Know niggas, they come and kill you on the camera', ""Big Rollie, it's dancin' bigger than a Pandie"", 'Go Oscar for Grammy, bitch, pull up ya panty', ""Fill up, I'ma flip it, I got bitches pull up and they get it"", ""I got niggas that's countin' for digits"", 'Say you make you a lot of new money', 'Know some killers pull off and they in the Wraith', 'CTD, pull up in the killa Bape', ""Call up Phillip-Phillip, gon' fill the bank"", ""Niggas up in the bank, we gon' drill the bank"", ""Fuck, we gon' kill the bank, get it"", 'I got broads, yeah, I get it', 'I get cards, yeah, I shitted', 'This how I live it, did it all for a ticket', 'Now Flex drop bombs when he spin it', ""And Bobby gon' trend it"", ""Jeff The Don doin' business"", ""Zana Ray fuckin' up shit and she doin' her business"", ""I be gettin' to the chicken, countin' to the chicken"", ""And all of my niggas gon' split it"", 'Panda, Panda', 'Panda, Panda, Panda, Panda, Panda', 'I got broads in Atlanta', ""Twistin' dope, lean, and the Fanta"", 'Credit cards and the scammers', ""Hittin' off licks in the bando"", 'Black X6, Phantom', 'White X6 look like a panda', ""Goin' out like I'm Montana"", 'Hundred killers, hundred hammers', 'Black X6, Phantom', 'White X6, panda', 'Pockets swole, Danny', ""Sellin' bar, candy"", ""Man, I'm the macho like Randy"", 'The choppa go Oscar for Grammy', 'Bitch nigga, pull up ya panty', 'Hope you killers understand me', 'I got broads in Atlanta', ""Twistin' dope, lean, and the Fanta"", 'Credit cards and the scammers', ""Hittin' off licks in the bando"", 'Black X6, Phantom', 'White X6 look like a panda', ""Goin' out like I’m Montana"", 'Hundred killers, hundred hammers', 'Black X6, Phantom', 'White X6, panda', 'Pockets swole, Danny', ""Sellin' bar, candy"", ""Man, I'm the macho like Randy"", 'The choppa go Oscar for Grammy', 'Bitch nigga, pull up ya panty', 'Hope you killers understand me', 'Panda, Panda']"
Hate Bein' Sober,Chief Keef,spotify:track:2oHM9KAdFdFvDCaE4V6RST,"[""I'm a smoker, Fredo a drinker, Tadoe off molly water"", 'Sober, my bitches stay sober', 'Sober', ""Damn, I hate bein' sober"", ""I hate bein' sober"", ""Damn, I hate bein' sober, I'm a smoker"", 'Fredo a drinker, Tadoe off molly water', ""But we can't spell sober"", 'Ballout roll up, when we roll up, bitches be on us', ""All the hoes, they love smokin' and love drinkin'"", 'Anti-sober for no reason', ""'Cause we can't spell sober"", ""Y'all know us, we smoke strong, bruh"", 'Watch me roll up', ""'Cause I can't spell sober"", ""On my tour bus we get dumb high, you's a floor boy"", ""Fredo got a hangover, he totin' a Cobra"", ""Last night he was shootin' shit up like O-Dog"", ""Reesy rollin', Tadoe got hoes on mollies"", ""Chief Sosa, Ballout, we high ridin' 'Raris"", ""My bitches love drinkin', some love smokin'"", ""Let my alcoholic bitch hit the dutch, she start chokin'"", 'Call up D-Money, now we throw money', 'All these bitches off the shits walk around like some zombies', 'Call up D-Money, now we throw money', 'All these bitches off the shits walk around like some zombies, yeah', ""Damn, I hate bein' sober, I'm a smoker"", 'Fredo a drinker, Tadoe off molly water', ""But we can't spell sober"", 'Ballout roll up, when we roll up, bitches be on us', ""All the hoes, they love smokin' and love drinkin'"", 'Anti-sober for no reason', ""'Cause we can't spell sober"", ""Y'all know us, we smoke strong, bruh"", 'Watch me roll up', ""'Cause I can't spell sober"", 'We got a hundred pounds of this shit (Yeah)', 'My stash house with them bricks (Yeah)', 'My pockets filled with them stacks (Uh)', 'My bitch be gone off a flat (Whoo)', 'She a hot tamale when she pop a molly', ""It's time to party, we party hard"", ""Drinkin', smokin', drinkin', smokin', drinkin', smokin'"", 'We high for sure', 'I came in back of that Rolls', ""Nigga, I ain’t stuntin' them hoes (Nah)"", 'I trick a bitch to suck dick, trick', 'What you spend on her, we spend on clothes', 'Too young for me, she want Sosa', 'Shooters in the Range Rover', ""That's GBE, when them .223's get to flyin', bitch, it's over"", ""See my ring chain and my Rolex when I’m flexin'"", ""Bitch, I got to get mine, nigga get outta line, I check 'em"", ""See this gangsta shit's done to perfection"", 'Nigga, better believe me, I make it look easy', ""Damn, I hate bein' sober, I'm a smoker"", 'Fredo a drinker, Tadoe off molly water', ""But we can't spell sober"", 'Ballout roll up, when we roll up, bitches be on us', ""All the hoes, they love smokin' and love drinkin'"", 'Anti-sober for no reason', ""'Cause we can't spell sober"", ""Y'all know us, we smoke strong, bruh"", 'Watch me roll up', ""'Cause I can't spell sober"", 'Uh, uh, uh', 'My weed so strong, my cheese so long (My cheese so long)', 'Roll so many joints, soon I might need a lung (Might need a lung)', 'Spend so many grands that I might need some bands (Might need some bands)', ""That's your bitch, why she actin' like she need a man? (Need a man)"", ""I’m faded (Faded), talkin' mill's 'cause I made it (Made it)"", ""Talkin' pounds 'cause I smoke it (Smoke it)"", ""Talkin' game 'cause I played it (I played it)"", 'I’m wasted (Wasted), Rose thats my favorite (Favorite)', 'OG kush, you can taste it (Taste it)', ""Buying Cris' by the cases (By the cases)"", 'I hate being sober', ""Don't smell no one smokin', me and my niggas gon' roll up"", ""Believe they gon' fire on you"", 'You think you could roll up', 'You smoke by the ounce', ""Well, bitch, I smoke by the pound 'cause"", ""Damn I hate bein' sober (Hahaha), I'm a smoker"", 'Fredo a drinker (Uh), Tadoe off molly water', ""But we can't spell sober (Sosa, what up nigga?)"", 'Ballout roll up (What up Fredo?), when we roll up, bitches be on us', ""All the hoes, they love smokin' and love drinkin'"", 'Anti-sober for no reason', ""'Cause we can't spell sober"", ""Y'all know us, we smoke strong, bruh"", 'Watch me roll up']"
Wow.,Post Malone,spotify:track:7xQAfvXzm3AkraOtGPWIZg,"[""Now it's everybody flockin', need a decoy"", 'Shawty mixing up the vodka with the LaCroix, yeah', 'G-Wagen, G-Wagen, G-Wagen, G-Wagen', 'All the housewives pullin’ up (Up, up)', ""I got a lot of toys, 720S bumpin' Fall Out Boy"", ""You was talkin' shit in the beginning (Mm-mm)"", ""Back when I was feelin' more forgivin' (More forgivin')"", ""I know it piss you off to see me winnin' (See me winnin')"", 'See the igloo in my mouth when I be grinnin’ (I be grinnin’), yeah', ""Hunnid bands in my pocket, it's on me"", 'Hunnid deep when I roll like the army', 'Get more bottles, these bottles are lonely', 'It’s a moment when I show up, got \'em sayin\', ""Wow"" (Wow, wow)', ""Hunnid bands in my pocket, it's on me (On me)"", 'Yeah, your grandmama probably know me (Know me)', 'Get more bottles, these bottles are lonely', 'It’s a moment when I show up, got \'em sayin\', ""Wow"" (Wow, wow)', 'Everywhere I go (Hey)', ""Catch me on the block like I'm Mutombo (Wow)"", '750 Lambo in the Utah snow (Skrrt)', 'Trunk in the front like that shit Dumbo, yeah', 'Cut the roof off like a nip-tuck', 'Pull up to the house with some big butts', 'Turn the kitchen counter to a strip-club (Yeah, wow)', 'Me and Dre came for the...', ""When I got guap, all of y'all just appeared (Wow)"", ""Before I dropped Stoney, none of y'all really cared (Cared)"", 'Now they always say, ""Congratulations,"" to the kid (Kid)', ""And this is not a 40, but I'm pourin' out this shit (Yeah)"", 'Used to have a lot, but I got more now (Yup)', ""Made another hit 'cause I got bored now (Yup)"", ""Always goin' for it, never punt fourth down"", 'Last call, Hail Mary, Prescott touchdown, ayy', ""Hunnid bands in my pocket, it's on me (On me)"", 'Hunnid deep when I roll like the army (Hey)', 'Get more bottles, these bottles are lonely', 'It\'s a moment when I show up, got \'em sayin\', ""Wow"" (Wow, wow)', ""Hunnid bands in my pocket, it's on me (Yeah, yeah)"", 'Yeah, your grandmama probably know me (Yeah, yeah)', 'Get more bottles, these bottles are lonely', 'It\'s a moment when I show up, got \'em sayin\', ""Wow""', 'Got \'em sayin\', ""Wow""', 'Ayy, ayy, wow', 'Sayin\', ""Wow""', 'Wow']"
MONTERO (Call Me By Your Name),Lil Nas X,spotify:track:1SC5rEoYDGUK4NfG82494W,"[""Ain't been out\u2005in\u2005a while anyway"", ""Was\u2005hopin' I could catch you throwin'\u2005smiles in my face"", ""Romantic talkin'? You don't even have to try"", ""You're cute enough to fuck with me tonight"", ""Lookin' at the table, all I see is weed and white"", ""Baby, you livin' the life, but nigga, you ain't livin' right"", ""Cocaine and drinkin' with your friends"", 'You live in the dark, boy, I cannot pretend', ""I'm not fazed, only here to sin"", ""If Eve ain't in your garden, you know that you can"", 'Call me when you want, call me when you need', ""Call me in the morning, I'll be on the way"", 'Call me when you want, call me when you need', ""Call me out by your name, I'll be on the way like"", 'Mmm, mmm, mmm', 'Mmm, mmm, mmm', 'Ayy, ayy', ""I wanna sell what you're buyin'"", 'I wanna feel on your ass in Hawaii', ""I want that jet lag from fuckin' and flyin'"", ""Shoot a child in your mouth while I'm ridin'"", 'Oh, oh, oh, why me?', 'A sign of the times every time that I speak', 'A dime and a nine, it was mine every week', ""What a time, an incline, God was shinin' on me"", ""Now I can't leave"", ""And now I'm actin' hella elite"", ""Never want the niggas that's in my league"", 'I wanna fuck the ones I envy, I envy', ""Cocaine and drinkin' with your friends"", 'You live in the dark, boy, I cannot pretend', ""I'm not fazed, only here to sin"", ""If Eve ain't in your garden, you know that you can"", 'Call me when you want, call me when you need', ""Call me in the morning, I'll be on the way"", 'Call me when you want, call me when you need', ""Call me out by your name, I'll be on the way like"", 'Oh, call me by your name (Mmm, mmm, mmm)', 'Tell me you love me in private', 'Call me by your name (Mmm, mmm, mmm)']"
Narcos,Migos,spotify:track:0wbnC9AUenxp613TYaJsGK,"['Trapping like the narco (Narco)', 'Got dope like Pablo (Pablo)', 'Cut throat like Pablo (Cut throat) ', 'Chop trees with the Draco (Draco)', 'On the Nawf, got Diego (Diego)', 'Say ""Hasta luego"" (Luego)', 'Muy Bien wrap a  kilo (Yeah)', 'Snub nose with potato', 'Straight out the jungle (Yeah, yeah, yeah, yeah, yeah)', '(Magnífico)', 'This real rap, no mumble (Yeah, yeah, yeah, yeah, yeah)', '(Arriba)', 'My skin black like mamba (Yeah, yeah, yeah, yeah, yeah)', 'Got stash boxes in Hondas (Yeah, yeah, yeah, yeah, yeah)', 'Straight out the jungle (Oh yeah)', 'Woo, bricks in the brick house (Yeah)', 'Use to hit licks and go to ma house (Licks, momma)', 'Straight out the jungle (Yeah, yeah, yeah, yeah)', ""Young nigga don't know nothin' now (Ya)"", 'Young nigga know too much now (Woo)', ""Bow bow bow, that'll slow them down (Uhh, yeah, yeah)"", 'We pick up the hundos (Hundos)', 'Then drop them off to Huncho (Huncho)', 'I came from the bando (Bando, beep beep)', 'Here go the wide load', 'Trapping like the narco (Narco)', 'Got dope like Pablo (Pablo)', 'Cut throat like Pablo (Cut throat)', 'Chop trees with the Draco (Draco)', 'On the Nawf, got Diego (Diego)', 'Say ""Hasta luego"" (Luego)', 'Muy Bien wrap a  kilo (Yeah)', 'Snub nose with potatoes', 'Straight out the jungle (Yeah, yeah, yeah, yeah, yeah)', '(Magnífico)', 'This real rap, no mumble (Yeah, yeah, yeah, yeah, yeah)', '(Arriba, arriba)', 'My skin black like mamba (Yeah, yeah, yeah, yeah, yeah)', 'Got stash boxes in Hondas (Yeah, yeah, yeah, yeah, yeah)', 'Straight out the jungle', 'Magnífico, arriba, arriba', 'Hey, cold gang with the cocaine (Coke)', 'The more money make more rain (Rain)', ""Pourin' up a pint while I'm baggin' propane (Baggin')"", 'Point blank range give a nigga nose rings (Yes)', 'Skip to my lou with a pack in the cat (Cat)', 'Jiffy, Lube, where the bricks, where they at? (Where)', 'Dripping, ooze, the Patek all wet (Ooh)', ""The birds in the trap, they ain't leavin' out they nest (Brr)"", 'Baguette, pavé set like meth (Yup)', ""Yup, runnin' with the pack got slept (Yeah)"", 'Hands in the cookie jar, cut his finger off (Ah)', ""Nigga bein' greedy, we gon' cut his tummy out (Huh)"", 'Hundred bricks on the roads, took a couple routes (Bricks)', ""Plush momma's house, Hermes and Fendi couch (Ayy)"", ""Uh, I ain't really with the razzle dazzle (Nah)"", 'Knock him off and then I throw him off the boat paddle (Brr)', 'Go to Tijuana, put the kilo on the saddle (Ooh)', 'Sack him, hit a lick and cop a pterodactyl (Sack)', 'Pap him, choppa biting down like an apple (Argh)', 'Mansion with the acres with the horses and the cattle (Hey)', 'Trapping like the narco (Narco)', 'Got dope like Pablo (Pablo)', 'Cut throat like Pablo (Cut throat)', 'Chop trees with the Draco (Draco)', 'On the Nawf, got Diego (Diego)', 'Say ""Hasta luego"" (Luego)', 'Muy Bien wrap a kilos (Yeah)', 'Snub nose with potatoes', 'Straight out the jungle (Yeah, yeah, yeah, yeah, yeah)', '(Magnífico)', 'This real rap, no mumble (Yeah, yeah, yeah, yeah, yeah)', '(Arriba, arriba)', 'My skin black like mamba (Yeah, yeah, yeah, yeah, yeah)', 'Got stash boxes in Hondas (Yeah, yeah, yeah, yeah, yeah)', 'Straight out the jungle', 'Magnífico, arriba, arriba', 'Take-Takeoff', 'No monkey in the jungle block hot like a sauna (Hah)', 'Bustas knocking on me, tryna weave with anacondas (Fire)', ""Jumpin' in the water, tryna sneak across the Waterglass (Splash)"", 'Gotta seek guards out, got me bit by a piranha (Ouch)', ""I'll bag it, bag a money, know I gotta have it"", ""Savage, but I'm still a gentleman in Cali (Cali)"", 'Static, nigga turn to mean about the cabbage (Uh)', 'Kill his whole family if he run off with your package (Brrt!)', 'I just put a pack on the way to Bogota (Pack)', ""Poke his eyes out, ain't no tellin' what he saw (Poke 'em out)"", ""I'ma wire his jaw, I don't know if he will talk (Wire jaw)"", ""Get the chainsaw and I'ma saw his legs off (Saw)"", ""They knew that we was gang but they sayin' that we a ring (Gang)"", ""Investigatin', takin' pictures of the whole team (DEA)"", 'Undercover, tryna do a sting', ""10 mil' on a plane, going straight to Medellín"", 'Trapping like the narco (Narco)', 'Got dope like Pablo (Pablo)', 'Cut throat like Pablo (Cut throat)', 'Chop trees with the Draco (Draco)', 'On the Nawf, got Diego (Diego)', 'Say ""Hasta luego"" (Luego)', 'Muy Bien wrap a kilo (Yeah)', 'Snub nose with potatoes', 'Straight out the jungle (Yeah, yeah, yeah, yeah, yeah)', '(Magnífico)', 'This real rap, no mumble (Yeah, yeah, yeah, yeah, yeah)', '(Arriba, arriba)', 'My skin black like mamba (Yeah, yeah, yeah, yeah, yeah)', 'Got stash boxes in Hondas (Yeah, yeah, yeah, yeah, yeah)']"
I Don't Like,Chief Keef,spotify:track:1h6kgem1ai8vUgO1rZOwfB,"['GBE Baby', ""I'on like"", ""Sos' baby"", ""You know how we rockin' baby"", 'Fake niggas, fake life', ""A fuck nigga, that's that shit I don't like (Bang-bang)"", ""A snitch nigga, that's that shit I don't like (Bang-bang)"", ""A bitch nigga, that's that shit I don't like (Bang-bang)"", ""Sneak dissers, that's that shit I don't like (Bang-bang)"", ""Don't like (Don't like), Don't like (Don't like)"", ""A snitch nigga, that's that shit I don't like (Sos', baby)"", ""Don't like (Don't like), Don't like (Don't like)"", ""A bitch nigga, that's that shit I don't like"", ""A popped bitch, that's that shit I don't like (Nah, nah, nah)"", 'I got a bad bitch, yeah, that bitch right (Yuh)', 'We smoke dope all day, all night', ""You smoke Reggie, that's that shit I don't like (Nah, nah, nah)"", ""We got a fuckin' Audi, that bitch all white (Skrr, skrr, skrr)"", ""Pull up on your bitch, bet she gon' like (Bang-bang, bang)"", ""Sosa bitch, yeah, I done gon' hype (Sosa)"", ""Pistol totin' and I'm shootin' on sight (Bang-bang)"", ""A snitch nigga, that's that shit I don't like (Nah, nah, nah)"", ""Your bitch want do the team, bet she won't fight (Nah, nah, nah)"", ""Bitch, we GBE; fuck who don't like! (GBE, baby)"", ""And we ain't gon' fight, our guns gon' fight (Bang-bang-bang)"", ""A fuck nigga, that's that shit I don't like (Bang-bang)"", ""A snitch nigga, that's that shit I don't like (Bang-bang)"", ""A bitch nigga, that's that shit I don't like (Bang-bang)"", ""Sneak dissers, that's that shit I don't like (Bang-bang)"", ""Don't like (Don't like), Don't like (Don't like)"", ""A snitch nigga, that's that shit I don't like (Don't like)"", ""Don't like (Don't like), Don't like (Don't like)"", ""A bitch nigga, that's that shit I don't like"", ""Fake Trues, that's that shit I don't like (No, no)"", ""Fake shoes, that's that shit I don't like (No, no)"", ""Fake niggas, that's that shit I don't like (No, no)"", ""Stalking-ass bitch, shit that I don't like (No, no)"", 'I done got indicted selling all white (Yuh)', ""But I won't never snitch, none in my life (Nah)"", ""I keep this shit 3Hunna, bitch, I'm goin' right (3Hunna, 3Hunna, 3Hunna)"", ""With my niggas when it's time to start taking lives (Bang, bang)"", ""Playing both sides, shit that I don't like (Nah, nah)"", 'Wartime spark broad day, all night (Bang, bang)', ""Playing both sides, shit that I don't like (Nah, nah)"", 'Wartime spark broad day, all night', ""A fuck nigga, that's that shit I don't like (Bang-bang)"", ""A snitch nigga, that's that shit I don't like (Bang-bang)"", ""A bitch nigga, that's that shit I don't like (Bang-bang)"", ""Sneak dissers, that's that shit I don't like (Bang-bang)"", ""Don't like (Don't like), Don't like (Don't like)"", ""A snitch nigga, that's that shit I don't like (Don't like)"", ""Don't like (Don't like), Don't like (Don't like)"", ""A bitch nigga, that's that shit I don't like"", ""I'm killing these niggas, shit that they don't like (No)"", ""Broski got the 30, he ain't tryna fight (Bang)"", 'Got your bitch, I was in it all night (She gone)', ""Fredo in the cut, that's a scary sight (Man down)"", 'You not with the shits you can die tonight', ""I only want the top, I ain't tryna pipe (Top)"", ""Them youngins with the shits, they be totin' pipe (Bang)"", ""Floatin' off at flat, I might take flight (Yeow)"", '3hunna, bitch, we hot, we done took flight', ""Taking shit down, we ain't like the price (We need that!)"", ""Thirsty-ass bitches, shit that we don't like"", ""OTFGBE your bitch like ('s go)"", ""A fuck nigga, that's that shit I don't like (Bang-bang)"", ""A snitch nigga, that's that shit I don't like (Bang-bang)"", ""A bitch nigga, that's that shit I don't like (Bang-bang)"", ""Sneak dissers, that's that shit I don't like (Bang-bang)"", ""Don't like (Don't like), Don't like (Don't like)"", ""A snitch nigga, that's that shit I don't like (Don't like)"", ""Don't like (Don't like), Don't like (Don't like)"", ""A bitch nigga, that's that shit I don't like"", ""Don't like (Don't like), Don't like (Don't like)"", ""A snitch nigga, that's that shit I don't like (Don't like)"", ""Don't like (Don't like), Don't like (Don't like)""]"
Look At Me!,XXXTENTACION,spotify:track:7floNISpH8VF4z4459Qo18,"[""My bitch don't love me no mo' (Ayy)"", 'She kick me out, I\'m like, ""Vro""', ""Damn, son, where'd you find this?"", 'Yah, ayy', 'Yah, ayy, yah', 'Ayy, haha, yah, yah, yah', 'Ayy', 'Ayy, ayy, ayy', 'I\'m like, ""Bitch, who is your mans?"" (Ayy)', ""Can't keep my dick in my pants (Ayy)"", ""My bitch don't love me no mo' (Ayy)"", 'She kick me out, I\'m like, ""Vro"" (Ayy)', ""That bitch don't wanna be friends (Ayy)"", 'I gave her dick, she amen (Ayy)', 'She put her tongue on my dick (Ayy)', 'Look at my wrist, about ten (Ayy)', 'Just got a pound of the boof (Ayy)', 'Brought that shit straight to the booth (Ayy)', 'Tommy my Hilfiger voots (Ayy)', 'She said, ""Wan\' fuck?"" Bitch, I do (Ayy)', 'You put a gun on my mans (Ayy)', 'I put a hole in your parents (Ayy)', 'I just got lean on my Ksubis (Ayy)', 'I got a Uzi, no Uzi', 'Fuck on me, look at me, ayy', 'Fuck on me, yah, look at me, ayy', 'Look at me, look at me, yah', 'Fuck on me, yah, ayy', 'Look at me, yah, fuck on me', 'Look at me, fuck on me, yah', 'Look at me, fuck on me', 'Yah, ayy', 'Tell these fuck niggas, voot me up, pipe up', 'Ayy, shouts out Bans and them, ayy', 'I took a white bitch to Starbucks', 'That little bitch got her throat fucked', ""I like to rock out, I'm misfit"", 'My emo bitch like her wrist slit', ""Curly hair bitch like I'm Corbin"", ""Got like three bitches, I'm Mormon"", ""Skeet on your main bitch's forehead"", ""Don't want your pussy, just want head"", 'Look at me, fuck on me', 'Look at me, fuck on me', 'Look at me, fuck on me', 'Look at me, yah, ayy!', 'Look at me, fuck on me', 'Look at me, fuck on me', 'Look at me, fuck on me']"
Shotta Flow,NLE Choppa,spotify:track:431dK0LJEvFi2KtmSK5HPX,"['Baby Mexico Choppa, man, Top Shotta', 'Baby Mexico Shotta, you heard me?', 'We finna talk our shit, you heard me?', 'YNR (Yeah)', 'Midas got a jugg, ayy (Yeah, yeah)', 'Yeah, yeah, yeah, yeah', 'I am a menace, keep me a rack just like tennis', ""I'm with the shit like I'm Dennis"", ""I started this shit, I'ma finish"", ""Niggas be hatin', tryna blemish my image"", 'Who want the smoke? .223 came with the scope', 'Extended clip long as a rope', 'We wipe his nose, just like he had him a cold', 'I knew that boy was a ho', ""Pull up with the gang, you know that we bangin'"", ""What is your set, nigga? What is you claimin'?"", 'I am a beast, you cannot tame it', ""Don't point a finger, this shit can get dangerous"", ""These niggas hatin', these niggas plottin'"", ""Ooh, he got money, I'm runnin' his wallet"", ""You say you a killer, lil' nigga, stop it"", ""In a shootout, your gun was droppin'"", 'You really a fraud, you cannot stomp on this yard', ""My niggas, they scammin', they swipin' them cards"", ""I am so high that I'm talkin' to stars"", ""I'm gone off them jiggas, I'm poppin' them bars"", ""Don't mind my pimpin', bitch, don't sweat me"", 'Chopper got a kick, call that shit Jet Li', 'Sauce Gang dripped up, what is your recipe?', ""Gon' get an F if a nigga try testin' me"", 'Whole lotta money, whole lotta guala', ""Hit the party fifty deep, nothin' but my shottas"", 'Nigga tried me so you know I had to pop him', 'So many bullets, it confused the doctor', 'Whole lotta racks, whole lotta stacks', ""Fuck a headshot, I'ma shoot him in the back"", ""Three-point-five rolled up in the Cack'"", ""We don't smoke reggie, this shit called gas"", ""I'm sticked up like a blind man"", ""I'm super hot like a frying pan"", ""He say that he gon' take somethin' from me"", ""Ayy, just know, he lyin', man"", ""I'ma up from my hip then blow like a whistle"", ""Your bitch suckin' dick like a Kool-Aid pickle"", ""Two bullets in your chest, that's a nipple"", ""And if a nigga run up, I'ma pop him like a pimple"", ""Get rich or die tryin', I'm feelin' like 50"", 'Brand new chopper got double-D titties', ""Nigga, don't play me, I don't get silly"", 'Love all the beef like a Southwest Philly, yeah', 'Yeah, love all the beef like a Southwest Philly, yeah, ayy', 'Bet, love all the beef like a Southwest Philly', ""I might just OD, Percs killin' me slowly"", ""Feelin' like I'm Kobe, can't nan' nigga hold me"", 'If he wanna run up on me, shoot him like Ginobili', ""And I'm with the shit, lil' homie, yeah, like I'm Toby (Yeah)"", ""And I'm with the shit, lil' homie, yeah, like I'm Toby, bitch (Yeah)"", ""Finna ad-lib, keep all that (Like I'm Toby, yeah, yeah)"", '(Like a school shooter named Toby, yeah)', ""Keep all that, Tay, yeah (This shit straight drop, lil' nigga, no cut)"", ""Ayy, Tay, keep all that, keep all that (Straight drop, lil' nigga, no cut)"", 'Yeah, yeah']"
