Track Name,Artist Name,URI,Lyrics
PTSD,G Herbo,spotify:track:1C8ux1YWLMHCenYJFiIV4Z,"['I turn the news on when I smell death in\u2005the\u2005air', 'I prove you\u2005wrong, I made it out of\u2005here', ""I don't belong, I see my past everywhere"", ""Don't stand too close to me, eternal PTSD"", 'I got a war zone on inside of my head', ""I made it on my own, they said I'd be in jail or dead"", ""I've seen my brothers fall over and over again"", ""Don't stand too close to me, I got PTSD"", 'I was hearing bangs like Chief Keef', ""Always yelling names that's deceased"", 'I go off my mind and my instinct (And my instinct)', ""Shootin' at the same time, we was in sync"", 'On the same thing, tryna repeat (Repeat)', 'We was in them whips, right back on the enemies', 'Stuffed on my last hit, I was in the middle seat', 'Fuck it, out the sun roof, brodie got a quick release', 'And we in a car real fast from police', 'Shots fired back, but his ass in the street', 'When I bought a forty, showed Brittany and Tiffany', ""Knowing if they call, it ain't shit they can't get from me"", 'Lot of warfare, 17, had a 50 piece', 'Flexed on niggas so you know they wanna kill a G', '(Royalty) Posted in the hood with some Bentley keys', ""(Loyalty) Roc died, showed 'em what it really mean"", ""I can't sleep 'cause it's a war zone in my head"", ""My killers good, they know I'm hands-on with the bread"", ""A million dollars ahead, I'm still angry and seeing red"", ""How the fuck I'm 'posed to have fun? All my niggas dead"", 'I turn the news on when I smell death in the air', 'I prove you wrong, I made it out of here', ""I don't belong, I see my past everywhere"", ""Don't stand too close to me, eternal PTSD"", 'I got a war zone on inside of my head', ""I made it on my own, they said I'd be in jail or dead"", ""I've seen my brothers fall over and over again (Hunh)"", ""Don't stand too close to me (Igh), I got PTSD"", 'Used to run home from the train stop (Yeah)', 'Running so fast, dodging raindrops', ""'Member got robbed at the park once (Yeah)"", ""'Member thinking that that bitch probably ain't cocked (Yeah)"", ""'Member I was with my mama one time"", 'Seen a nigga through the glass, hit a nigga with a bankshot (Bow)', 'Point-blank, head hanging off his tank top (Woo)', 'Walked off, we drove off, went to GameStop (Skrrt)', 'Quiet ride there, picked up San Andreas (Hunh)', ""Certain things we ain't talk about, mama, we just prayed off"", ""We seen it all, don't get involved"", 'Carry the weight of the world like a shawl (Yeah)', 'Conceal and revealing to people in court', 'I still can feel it, I know that the world is evil, in case you thought a nigga forgot it', 'When my homie was bleeding out, another homie went in his pockets (Tsk)', 'Please do not run up on me, not even as fans', 'Niggas get fanned down on the Dan Ryan', ""I'm flying, I'm scary as hell, I need me a Xan (Igh)"", 'The days seem longer as life gets shorter', 'We know sex, drugs, money, all in that order', ""Ain't no structure, no peace, we've lost our order"", 'Leaving me with anxiety, fucking up my sobriety (Lil Uzi Vert, yeah)', ""It's a war zone laying inside my head"", ""I still think about all my niggas that's dead"", ""I'm too paranoid, yeah, I know you heard what I said"", ""I'm too paranoid, I make sure all my opps, they bled (Woah)"", 'Draining all my energy, no, I cannot sleep, uh-huh', ""I'm affected by the streets, no appetite, I can't eat"", ""I only see red when I see, I think it's my PTSD (Damn)"", ""I think it's my PTSD (Woah), I think it's my PTSD, yeah (Woah)""]"
Snake,Lil Keed,spotify:track:3wdnX9UwfyXkNq0FJVhQQD,"['Pop a Percocet, get higher than a kite', 'Fuck your bitch, get her ass out of sight', ""Came from the trenches, but I'm living nice"", ""Came for the riches, ain't got time to fight"", 'Came for your ho, she wan’ spend the night', ""I ain't come alone, fire on my side"", ""No armor on, I'm not a knight"", 'Nigga too sharp, nigga need a knife', ""Drink it out a juice, I don't need a Sprite"", ""Fuck 'em by the twos, they both tryna ride"", ""Then I ditch 'em both, I ain't even right"", ""Hightop Chanel, bitch, we drippin' right"", 'Young YSL, bitch, we livin’ life', 'Snake, snake, snake, snake', 'Snake, snake, snake, snake', ""I’m goin' right in"", 'And these pockets, I’m rising', 'Just know that we tied in', 'And that pussy, I dive right in', 'Before the license, I was driving', ""Set 'em up like a tent, finna get stretched"", ""Just like Grinch, takin' that shit"", ""When you get off the exit, you ain't get stretched"", 'We do it for...', 'Snake, snake, snake, snake', 'Snake, snake, snake, snake', 'They ain’t finna post', ""I'm ballin', fuck a coach"", ""Flyin' private, not coach"", 'Run this shit, no Colts', 'Diamonds real froze, nigga catch a cold', 'Nigga slang the pole, do it for your bros', ""He like to do it for the camera, we'll make you pose"", 'Get back scrambling, Michael Vick mode', 'Aim, aim, drug pain', 'Aim, aim, stay in your lane', 'Do it for...', 'Snake, snake, snake, snake']"
One Night,Lil Yachty,spotify:track:40yJGQyEaBbIkXpwMFkXip,"[""But I can't have no wife"", 'I just want you for the night', 'I know you want this for life', 'Taking pictures with all my ice (All my ice)', ""But I can't have no wife"", 'I just want you for the night (Just for the night)', ""I know you want this for life (No, you don't)"", 'Fuck you so good you be calling out the Christ (Oh, my God)', 'Bottles of the Tech, got it laid on ice', 'We spent four seasons at the Four Seasons twice (Make it my home)', 'You be calling all your homegirls like, ""I\'m his wife""', ""Hell nah, you trippin', reevaluate your life"", ""I can't love no bitch, every single ho is trife (Hell no)"", 'I sip dirty Sprite just to get me through the night', 'But I need you there (Need you there)', 'Promise that I need you there', ""Ain't no other bitch gon' fuck me like you do, I swear"", 'Put that on my gang, I swear', ""I just can't put you on front street like you want, I know"", 'But baby, you is not no ho', ""And I put it on my gang, I'm not no average Joe (No average Joe)"", ""It's Yachty from the block, you know (Yeah)"", 'I know you want this for life', 'Taking pictures with all my ice', ""But I can't have no wife"", 'I just want you for the night', 'I know you want this for life', 'Taking pictures with all my ice', ""But I can't have no wife"", 'I just want you for the night', ""Don't you tell no one"", ""No, no, no, baby, don't you tell no one"", ""We gon' keep this just between us, we gon' have some fun (Gon' have some fun)"", 'Fuck until the morning come', ""When the morning come, I'll make you cum"", 'But then then I gotta run', ""'Cause, baby, I got shit to do"", 'Stack my bread up, fuck your head up', ""That's just what I'll do (That's what I'll do)"", ""Chillin' on my avenue"", ""If you ain't remember, I remember, girl"", ""That's where I first met you"", 'You had you a drink or two (You had a drink or two)', ""You came over half unsober callin' me your boo (Oh, no, no, no)"", 'Then you turned around and fucked the crew (No, no, no, no, no)', 'I got no love for you', ""I can't have no wife, one night"", 'You want this for life', ""But I can't, I can't have no wife"", 'No wife, no, no wife (No wife)', 'Just one night, one night', ""I can't, can't have no wife (I can't, can't have no wife)"", 'I know you want this for life', ""But I can't have no wife (No, no, no, no, no wife, no)"", 'I just want you for one night', 'I just want you for one night', 'I know you want this for life, but no', 'No, no, no']"
4 AM,2 Chainz,spotify:track:1nX9KhK3Fff27SnrIor2Yb,"['Yeah, yeah', 'Damn right, bro', ""4 AM, I'm just gettin' started"", 'For my birthday I threw me a surprise party', ""Reminiscin' 'bout the trap, playin' the first Carter"", 'My life changed when I had my first daughter', ""Got my first quarter flippin' 50 dollar slabs"", ""Your nigga's lookin' at the bills, askin' you for half"", 'Cut from a different cloth, take pride in results', ""Anytime she wanna dip I'm providin' the sauce"", 'You on side of the boss, so you kind of the boss', ""You keep playin' with me, I end up signing your boss"", 'Drop an EP on a nigga for the free-free on a nigga', 'Yeah you ZZ on a nigga, king like BB on you niggas', 'Rock with Champagne P', ""If it wasn't for the struggle then I wouldn't be me"", 'Call me Deuce or Dos, anything but broke', 'Got my aim from the scope, got the game by the throat, damn!', 'Okay, you popped up on me by surprise (Yeah, yeah)', ""You see I never took you for the poppin' type (Straight up)"", ""Damn, it's 4 AM so please believe the hype (It's lit)"", ""Hit the lights (Yeah), I'm way over top"", 'Pop it, flick it', 'Drop a pin, send a location (Skrrt, skrrt)', ""I'ma pull up in that bullet-coupe spaceship (Skrrt, skrrt)"", 'Drop off a bag of some dangerous (Yeah)', ""I'ma hit you, 4 AM, see if you make it (Yeah)"", 'I dropped ColleGrove out the sky, ooh', ""In a group with the best rapper that's alive, ooh"", 'Never turn my back on my slime, ooh', ""I ain't wanna fuck the bitch but she was fine, ooh"", 'Hold up baby, let me take my time, ooh', 'Hard to get some head and try to drive, ooh', ""Jumpin' out the cake and that's surprisin', ooh"", ""Pickin' up the duffel bag like exercisin', ooh"", ""Bought mama new house 'cause she deserve it, ooh"", ""Practice makes perfect but nobody's perfect, ooh"", 'Escobar is not open for service, ooh', 'Send you to Dr. Miami for your surgery, ooh', 'Okay, you popped up on me by surprise (Yeah, yeah)', ""You see I never took you for the poppin' type (Straight up)"", ""Damn, it's 4 AM so please believe the hype (It's lit)"", ""Hit the lights (Yeah), I'm way over top"", 'Pop it, flick it', 'Drop a pin, send a location (Skrrt, skrrt)', ""I'ma pull up in that bullet-coupe spaceship (Skrrt, skrrt)"", 'Drop off a bag of some dangerous (Yeah)', ""I'ma hit you, 4 AM, see if you make it (Yeah)"", 'Ooh, Riccardo Tisci on the crewneck', ""Ooh, on a killin' rapper spree and nigga, you next"", ""Ooh, they talkin', chillin', watchin' Netflix (Straight up)"", 'Ooh, I used to trap and watch bootlegs', ""Ooh, I'm on my wave like a durag"", 'Ooh, I see your boo, now where your crew at?', ""Ooh, talkin' tequila for the pipe-up"", 'Ooh, I hope you got a clean vagina, yeah', 'Drench god, drench god, really', ""Representin', we the squad, really (Oh, yeah)"", 'Tec got the Rollie, now I get it', 'I used to sell drugs for a living', ""Got me a job sellin' records"", 'Had to use my jeweler for a reference', 'Might buy a charm with the extras', 'Might use her legs for a necklace', 'Okay, you popped up on me by surprise (Yeah, yeah)', ""You see I never took you for the poppin' type (Straight up)"", ""Damn, it's 4 AM so please believe the hype (It's lit)"", ""Hit the lights (Yeah), I'm way over top"", 'Pop it, flick it', 'Drop a pin, send a location (Skrrt, skrrt)', ""I'ma pull up in that bullet-coupe spaceship (Skrrt, skrrt)"", 'Drop off a bag of some dangerous (Yeah)', ""I'ma hit you, 4 AM, see if you make it (Yeah)"", ""Don't stop trappin', boy"", ""Got 'bout 12 racks this mornin'"", ""Got 'bout 12 racks"", ""Started last night, still goin'"", '12 racks strong', 'Got the pitbull in the corner, she pregnant', 'Got the crackhead in the corner, she pregnant', ""Everybody in here pregnant, 'cept my partner and them""]"
2055,Sleepy Hallow,spotify:track:4XvcHTUfIlWfyJTRG0aqlo,"['I just wanna ride (Great John on the beat by the way)', ""Like it's 2055, huh"", 'Huh, huh, huh', 'I just wanna slide, huh', ""Parties in the sky like it's 2055, huh"", 'She said ""Boy you nice, boy you nice"", huh', 'Heart cold like some water and some ice (Huh)', 'Why would you sacrifice (Huh)', ""Knowing you could die? Ain't nobody by your side, huh"", 'I know niggas cap (Cap) and bitches lie', ""Came from dirt, can't go back, you could see it in my eyes, huh"", 'Real niggas cry blood (Blood), hope my kid never try drugs (Huh)', 'All I wanted was some love, would that trade for a gun (Huh)', ""Big pack on me now, 'member back then I was fucked up, huh"", ""I don't really want friends, everybody fake, I don't got trust, but"", 'I just wanna slide, huh', ""Parties in the sky like it's 2055, huh"", 'She said ""Boy you nice, boy you nice"", huh', 'Heart cold like some water and some ice (Water and some ice, water and some ice)', 'I just wanna slide, huh', ""Parties in the sky like it's 2055, huh"", 'She said ""Boy you nice"" (Nice), ""Boy you nice"" (Nice), huh', 'Heart cold like some water and some ice', ""Shawty get energized, huh, livin' life"", ""Spilled some liquor on her inner thigh, but she ain't tired"", 'She just turn it up, huh, I could get you brushed, huh', ""Zaza got me stuck, sorry I can't open up"", 'Fuck it we try (Huh), gotta compromise (Huh)', 'He want beef with gang, but he dont know it come with fries (Huh)', ""That's AKs and nines (Huh), please don't play with mines (Huh)"", 'My body different, I know they love that line but', 'I just wanna slide, huh', ""Parties in the sky like it's 2055, huh"", 'She said ""Boy you nice (Nice), boy you nice (Nice)"", huh']"
Praise God,Kanye West,spotify:track:0WSEq9Ko4kFPt8yo3ICd6T,"['The\u2005self-soilers, the harmony-hushers', 'Even if you are\u2005not ready for the day, it cannot always be night', 'Serve, flex, I do work (Work)', ""Six, I'm like Mike"", ""He's out of sight, woo"", 'You done got me piped', 'Two-man like Ike', 'Six out the spot (Uh, uh)', 'Into the night', ""Yeah, I'm shakin' the drop (Drop)"", ""I'm still up on top (Aight)"", 'I been had the bop', ""The devil my opp, can't pay me to stop (It's lit)"", 'My God at the top (La Flame)', ""We gon' praise our way out the grave, dawg"", ""Livin', speakin', praise God"", ""Walkin' out the graveyard back to life"", 'I serve, follow your word, see with new sight, into the night (Hey)', ""Yeah, this life I'm livin' (I'm livin')"", 'All the advice been tipped in (That thang)', ""Gave me that grip, no slippin' (That grip)"", ""Out of my mind, went trippin' (My mind)"", ""Tell me take two when I'm on one (I'm on)"", 'That lookout like no one', 'Kept it real tight like your son (Your son)', 'Yeah (La Flame)', ""We gon' praise our way out the grave, dawg"", ""Livin', speakin', praise God"", ""Walkin' out the graveyard back to life"", 'I serve, follow your word, see with new sight, into the night', 'Still on side, huh, still outside', '****, attention, still outside, huh, still outside', 'Tame Imp—, Tame Impala, ****', 'Tame Impala, stay outside, huh', ""And I'm still outside, I'm still outside, still outside, huh"", ""Let's get right, huh, let's get right, uh, let's get right, uh, huh"", ""Let's get right, let's get (Ayy, ayy, ayy), let's get right"", ""Let's get (Ayy, ayy, ayy), let's get—"", ""Look at new scenes, I opened my life, I'm subject to memes"", 'I signed a few ****, I polished their dreams', 'An angel on earth, come under my wing', ""Stop runnin' your publishers, ****"", 'They publish the headlines and say the wrong things', ""Y'all treat your Lord and Savior like renters' insurance, you know what I mean?"", 'Bada the bada the boom, I bada the boom, I bada the bing', 'I need a new girl, my old one was mean', 'I had to let go, forgave all them evils that came to my shows', 'I channeled them bad **** all in abode', 'I channeled your trust, I channeled the turbulence, came with the life', ""I gathered my sinners and asked if I'm right, let's get"", 'I just get right, ****, huh', ""Let's get right, let's get right, let's get right, shh, shh"", ""Ain't on sight, it's on sight"", ""I don't know you, you, you, you, it's on sight"", ""I don't know you, you, you, you (Ayy, ayy), let's get right"", 'Ayy, all of my **** on Channel 5', ""I don't channel ten 'til it go time"", ""Used to throw up my uncle's spaghetti"", 'Been told to tote since before I was ready', 'Back when my mama told me that I was challenged', 'A single Black woman, you know that she petty', 'I turned a heavy heart to two million dollars', 'I put that in totals, reverse outta debty', 'I gotta, I gotta put on a rager one time', 'I swung the powder, went major one time', ""I know some white people servin' no time"", 'I gotta do it for me, do it for, pray for me', ""Do it for all the ones dyin'"", ""I wanna do it for all the ones cryin'""]"
WAIT FOR U (feat. Drake & Tems),Future,spotify:track:59nOXPmaKlBfGMDeOVGrIK,"['Время не имеет значения (Я буду ждать тебя)', 'Presidential Rollie, RM, подожди (Выше, говорю выше-е-е-е)', 'Как только я нахожу время, все в порядке (Эй)', 'ATL Jacob, ATL Jacob', 'Ты молишься за моих демонов, детка, я тебя понял', 'Каждый раз, когда я пью лин, я становлюсь уязвимым', 'Я знаю звуки грома, когда он приходит', 'Она понимает, я не могу брать ее туда, куда иду', 'Я был в поле, как дети кукурузы', 'Я могу слышать твои слезы, когда они падают на телефон', 'Злишься на себя, потому что не можешь оставить меня в покое', 'Сплетни, грязь, это не то, что мы делаем (Мир был окончен)', 'Путешествую по миру (Ты будешь плакать или попытаешься добраться до меня?)', 'На телефон капают слезы (Скажи мне сейчас, я хочу, чтобы ты ясно выразился, да)', 'Становлюсь уязвимым, когда принимаю таблетки (Скажи мне сейчас, мне нужно, чтобы ты ясно выразился, да)', 'Когда ты пьяна, скажи мне, что ты чувствуешь (Я буду ждать тебя, ждать тебя)', 'Когда я пьян, я вижу реальность (Я буду ждать тебя, я буду ждать тебя)', 'Пожалуйста, скажи, что это (Я буду ждать, буду ждать тебя, тебя )', 'Не говоришь это, потому что знаешь, что я хочу услышать (Я буду ждать тебя, я буду ждать тебя)', 'Да, я объездил весь мир', 'Я сижу на балконе и удивляюсь, как ты себя чувствуешь', 'Моя карьера, отнимает время у женщин', 'Я не могу убедить тебя в том, что буду любить тебя до конца жизни (Я буду ждать тебя, ждать тебя)', 'Я на твоей линии, чувства текут как река', 'Ты отвечаешь в Kiki on the River (Я буду ждать тебя)', 'Сообщение доставлено (Я буду ждать тебя), но я знаю, что ты не ответишь', 'Зачем нас познакомила, если знала, что вы вместе? (Я буду ждать тебя, тебя, тебя)', 'Заставила меня пожать ему руку, когда вы знакомы пару ебаных минут (Я буду ждать, тебя)', 'Заставляешь ходить по планке, знаешь, что я пловец (Я буду ждать тебя)', 'Должен был стать твоим псом, но ты посадила в будку', 'Детка, закрой намордником, весь этот лай за ужином', 'Я издевался над тобой, когда у тебя был крошечный президент', 'Ты стала лучше, когда встретила меня, и это не совпадение', 'Пытался выбить из тебя самое лучшее, наверное, я не настолько влиятелен', 'Думаю, я не тот, кто предназначен для тебя', 'Я могу слышать твои слезы, когда они падают на телефон', 'Злишься на себя, потому что не можешь оставить меня в покое', 'Сплетни, грязь, это не то, что мы делаем (Мир был окончен)', 'Путешествую по миру (Ты будешь плакать или попытаешься добраться до меня?)', 'На телефон капают слезы (Скажи мне сейчас, я хочу, чтобы ты ясно выразился, да)', 'Становлюсь уязвимым, когда принимаю таблетки (Скажи мне сейчас, мне нужно, чтобы ты ясно выразился, да)', 'Когда ты пьяна, скажи мне, что ты чувствуешь (Я буду ждать тебя, ждать тебя)', 'Когда я пьян, я вижу реальность (Я буду ждать тебя, я буду ждать тебя)', 'Пожалуйста, скажи, что это (Я буду ждать, буду ждать тебя, тебя )', 'Не говоришь это, потому что знаешь, что я хочу услышать (Я буду ждать тебя, я буду ждать тебя)', 'Ранним утром или поздней ночью', 'Время не имеет значения', 'Мир был окончен, ты будешь плакать или попытаешься добраться до меня?', 'Скажи мне сейчас, я хочу, чтобы ты ясно выразился, да']"
Lean Wit Me,Juice WRLD,spotify:track:3oDkdAySo1VQQG0ptV7uwa,"[""Will I die tonight? I don't know, is it over?"", ""Lookin' for my next high, I'm lookin' for closure"", 'Lean with me, pop with me', 'Get high with me if you rock with me', 'Smoke with me, drink with me', 'Fucked up liver with some bad kidneys', 'Lean with me, pop with me', 'Get high with me if you rock with me', 'Smoke with me, drink with me', 'Fucked up liver with some bad kidneys', ""Told her if I die, I'ma die young"", ""Every day I've been gettin' fucked up"", 'Finally know the difference between love and drugs', 'Shawty tell me I should really sober up', ""This shit ain't fiction, it's too real, too real"", 'Fuck one dose, I need two pills, two pills', ""I'm lookin' for trouble so I know I'm gonna find it"", ""Ring, ring, plug hit my phone, perfect timin'"", ""I know I'm not right"", ""But I'm not wrong, no, I'm not wrong"", ""Girl, you hate it when I'm too high"", ""But that's where I belong, where I belong"", 'Lean with me, pop with me', 'Get high with me if you rock with me', 'Smoke with me, drink with me', 'Fucked up liver with some bad kidneys', 'Lean with me, pop with me', 'Get high with me if you rock with me', 'Smoke with me, drink with me', 'Fucked up liver with some bad kidneys', 'Eyes red, no Visine', 'Crashed the Mustang, no Saleen', 'Yeah, I love beans, yeah, I love lean', 'I laugh when they ask if my piss clean', 'Huh, smoke with me, huh, pop with me, huh', 'Ayy, Gucci store, come and shop with me', ""If I overdose, bae, are you gon' drop with me?"", ""I don't even wanna think about that right now"", ""Let's get too high, reach a new height"", 'Take the shrooms and the pills at the same time', 'Went to Hollywood thrills from the street life', ""Took too many drugs, now I don't feel right"", 'Lean with me, pop with me', 'Get high with me if you rock with me', 'Smoke with me, drink with me', 'Fucked up liver with some bad kidneys', 'Lean with me, pop with me', 'Get high with me if you rock with me', 'Smoke with me, drink with me', 'Fucked up liver with some bad kidneys (Bad kidneys)', 'Oh-oh', 'Oh-oh-oh']"
